order_id,customer_id,date,nearest_warehouse,shopping_cart,order_price,delivery_charges,customer_lat,customer_long,coupon_discount,order_total,season,is_expedited_delivery,distance_to_nearest_warehouse,latest_customer_review,is_happy_customer
ORD486391,ID0207085221,2019-07-20,Bakers,"[('Alcon 10', 1), ('Universe Note', 1), ('Candle Inferno', 1)]",12830,55.99,-37.81683,145.0142511,5,12244.49,Winter,False,1.8374,"dead battery fully charged over night, with three hours of basic minimal use, battery was down to 30%, send back for a refund.",False
ORD395285,ID4735688178,2019-03-22,Thompson,"[('Lucent 330S', 2), ('Toshika 750', 1), ('iStream', 1), ('Olivia x460', 1)]",8155,34.03,-37.8031951,144.94913569999997,5,7781.28,Autumn,False,1.0706,"graet phone great phone, fast shipping. wanted to grab another note 3 (i already have one) before they are gone.",True
ORD449112,ID2948774548,2019-11-26,Thompson,"[('Alcon 10', 2), ('iStream', 2)]",18200,147.105,-37.8131321,144.95169909999996,5,17437.105,Spring,True,0.4104,"durable and easy to use, easy to setup had this phone for a week. easy to use, easy to setup, seems durable. fast shipping.",True
ORD104172,ID2277912699,2019-05-26,Thompson,"[('Olivia x460', 2), ('Toshika 750', 1), ('iAssist Line', 1)]",8995,78.30000000000001,-37.8230126,144.94202230000005,25,6824.55,Autumn,False,1.2335,read before you buy battery drains out very fast and it didn’t have headphone. only charge and phone are the accessories,False
ORD192349,ID1463620403,2019-12-14,Bakers,"[('Universe Note', 2), ('iStream', 2)]",7200,71.69,-37.8160731,145.00079680000005,5,6911.69,Summer,False,0.8349,"versatile use, can watch movies or news.  able to use as remote for vehicle.  or use as a communication hub for the home.  great produc!!!",True
ORD310616,ID3213448164,2019-10-26,Thompson,"[('Lucent 330S', 2), ('Olivia x460', 2), ('Candle Inferno', 1)]",5340,79.73,-37.8078068,144.96140269999995,0,5419.73,Spring,False,1.3721,five stars great!!,True
ORD336464,ID2442297436,2019-06-26,Thompson,"[('Universe Note', 2), ('Candle Inferno', 2), ('Lucent 330S', 2)]",10220,65.69,-37.8175692,144.95228,0,10285.69,Winter,False,0.7121,digico doesn't disappoint.,True
ORD467573,ID0650272644,2019-02-26,Bakers,"[('Thunder line', 2), ('iAssist Line', 1), ('pearTV', 2)]",19205,82.67,-37.8105137,144.98078619999995,25,14486.42,Summer,True,1.2717,very disappointed. the phone in the box wasn't the one that was supposed to be in there. the phone was already a active phone so i couldn't activate it. very disappointed.,False
ORD407987,ID0760183043,2019-09-20,Thompson,"[('Alcon 10', 2), ('iAssist Line', 2), ('pearTV', 1)]",28660,101.64,-37.820326,144.950964,15,24462.64,Spring,True,0.9182,"nothing is like pixel xl love the phone, extremely fast comparing to my z5, premium feel, i cannot stop myself from playing it.",True
ORD380164,ID2577925392,2019-11-01,Thompson,"[('Toshika 750', 1), ('iAssist Line', 1)]",6545,68.88,-37.812667,144.94737030000005,15,5632.13,Spring,False,0.0265,exccelent produxt very good and fast shipping fast,True
ORD191608,ID2441346320,2019-09-03,Bakers,"[('iAssist Line', 2), ('Lucent 330S', 1), ('Toshika 750', 1), ('Olivia x460', 2)]",12450,78.56,-37.804722,144.98409919999997,15,10661.06,Spring,False,1.1416,i've had the first gen thunder since it first came out and it has worked well for me. i purchased the 2nd gen during gold day and so far i'm happy. it seems to have an improved speaker which provides enhanced sound for music and such.,True
ORD134387,ID6167441027,2019-06-24,Thompson,"[('Candle Inferno', 2), ('iAssist Line', 1)]",3085,79.21,-37.8091936,144.9610091,0,3164.21,Winter,True,1.2857,good bang for buck good value,True
ORD384705,ID6167254946,2019-04-17,Nickolson,"[('Lucent 330S', 2), ('Universe Note', 1), ('Thunder line', 2), ('Olivia x460', 1)]",11495,76.68,-37.8164932,144.97101919999997,25,8697.93,Autumn,True,0.2672,works great! perfect for my office!,True
ORD446100,ID0257505385,2019-06-12,Thompson,"[('iAssist Line', 2), ('Lucent 330S', 1), ('pearTV', 1), ('Candle Inferno', 2)]",12850,68.58,-37.7991533,144.96268419999996,15,10991.08,Winter,True,2.0374,"the phone makes sizzling sounds as if it is being ... the phone makes sizzling sounds as if it is being fried, and when i try to unlock the phone sometimes it will not allow me to unlock it.",False
ORD072026,ID2569100354,2019-06-05,Bakers,"[('Universe Note', 1), ('Lucent 330S', 2), ('Toshika 750', 1)]",10230,79.48,-37.823322,144.9938042,5,9797.98,Winter,True,1.4887,excellent shape awesome buy!,True
ORD478557,ID0306905245,2019-09-20,Thompson,"[('iAssist Line', 1), ('Olivia x460', 2)]",4675,77.39,-37.8116403,144.93834980000003,10,4284.89,Spring,False,0.7754,"it's awsome,universe note 9 i like the universe note 9, it looked brand new , working great, thank you, the only issue i had was the charger was no good, but got a new charger and the phone is awsome, its worth 5 stars. i am a happy customer",True
ORD198477,ID0472236191,2019-06-18,Nickolson,"[('Alcon 10', 1), ('Toshika 750', 1)]",13270,82.14,-37.8014402,144.96636840000005,10,12025.14,Winter,True,1.93,"everything perfect the product came on time with good package, excellent conditions, no problems at all, my uncle is so happy with his new phone and the price is the best thing.:)",True
ORD088621,ID1492145818,2019-06-06,Thompson,"[('Olivia x460', 1), ('Lucent 330S', 1), ('iStream', 2)]",2755,48.75,-37.8132459,144.9514796,15,2390.5,Winter,False,0.3931,not happy! screen goes black and phone keeps restarting!,False
ORD361962,ID0847529899,2019-07-04,Nickolson,"[('Candle Inferno', 2), ('Thunder line', 1), ('pearTV', 2)]",15660,76.04,-37.8237966,144.9684956,5,14953.04,Winter,True,0.5864,"perfect budget phone great budget phone! runs great, battery life is excellent, camera is good too!",True
ORD474873,ID0361775706,2019-06-05,Bakers,"[('Lucent 330S', 1), ('Alcon 10', 1)]",10180,81.72,-37.7993128,144.98776740000002,15,8734.72,Winter,True,1.3584,great phone excellent 2019 smartphone capabilities at a really affordable price. large and readable screen. latest android edition.,True
ORD217449,ID5630513726,2019-01-01,Thompson,"[('pearTV', 1), ('Toshika 750', 2)]",14950,72.53,-37.8172889,144.95259919999995,15,12780.03,Summer,False,0.7075,purchased for a replacement phone my moms phone died we purchased this as replacement. came on time and infernod right up. works just like old phone. happy with the purchase.,True
ORD285436,ID0176721322,2019-07-06,Nickolson,"[('iAssist Line', 1), ('Universe Note', 1)]",5675,62.58,-37.81464520000001,144.9670498,25,4318.83,Winter,False,0.4916,computer in your hand this is an early review and i reserve the right to change it and probably will i've only had the phone for a couple days now but i'm absolutely amazed by everything so far and think it was worth every penny,True
ORD068466,ID0266733534,2019-03-24,Nickolson,"[('Thunder line', 1), ('Universe Note', 1), ('Alcon 10', 2), ('Candle Inferno', 1)]",23960,68.05,-37.8097118,144.97655480000003,25,18038.05,Autumn,False,1.165,beautiful screen very very impressed with this phone.......was unsure about the speaker.......phone is top notch.....,True
ORD181176,ID0493051207,2019-09-29,Bakers,"[('Toshika 750', 2), ('Alcon 10', 2)]",26540,87.14,-37.80691820000001,144.989461,5,25300.14,Spring,True,0.6124,scam the screen died after 2.5 months of slow and painful work,False
ORD001500,ID0591407999,2019-11-04,Nickolson,"[('Olivia x460', 1), ('pearTV', 2), ('Candle Inferno', 2), ('Alcon 10', 1)]",23655,76.11,-37.821211100000006,144.9615682,15,20182.86,Spring,False,0.76,my grandson loved it. i had the smaller one but wanted to larger one for him.,True
ORD019574,ID0663480235,2019-05-04,Nickolson,"[('Alcon 10', 2), ('Olivia x460', 2)]",20350,63.07,-37.825245,144.96819169999995,15,17360.57,Autumn,True,0.7498,overheating the phone overheats and goes off on it's own. i regret of buying this phone. this is the worst phone i have ever purchase and it's a shame i can't return it.,False
ORD278924,ID0307349873,2019-05-04,Thompson,"[('Alcon 10', 2), ('iAssist Line', 2), ('Toshika 750', 2)]",30990,61.11,-37.8133428,144.94362719999995,0,31051.11,Autumn,False,0.3117,las caracteristicas genial relacion precio valor.,True
ORD438288,ID0650276838,2019-01-13,Bakers,"[('iStream', 1), ('Universe Note', 1), ('Lucent 330S', 1)]",4830,97.24,-37.8117087,144.982926,0,4927.24,Summer,True,1.0989,very good picture and it even takes pictures which is awwsome. you even get a free month of digico gold which came in very handy around christmas time,True
ORD444100,ID4716795515,2019-06-09,Thompson,"[('iAssist Line', 1), ('Lucent 330S', 2), ('Olivia x460', 2)]",7135,64.99,-37.8190181,144.9526176,0,7199.99,Winter,False,0.8585,five stars i love ❤ my new phone 📱… thank for saving me money 💰,True
ORD051252,ID0575429262,2019-11-26,Nickolson,"[('iAssist Line', 1), ('Universe Note', 2), ('Olivia x460', 1)]",10350,106.7,-37.8186886,144.98397780000005,10,9421.7,Spring,True,1.2687,easy to use tablet. price is pretty good. my mom loves it.,True
ORD491502,ID6167489449,2019-08-05,Nickolson,"[('Universe Note', 1), ('Candle Inferno', 1)]",3880,64.7,-37.8139299,144.9603733,10,3556.7,Winter,False,0.9597,five stars best phone i have brought to date!,True
ORD346980,ID0331163949,2019-04-17,Nickolson,"[('Universe Note', 1), ('Toshika 750', 1), ('Thunder line', 1), ('Alcon 10', 1)]",18900,71.67,-37.7995415,144.9690663,25,14246.67,Autumn,False,2.1214,"wonderful purchase this phone/tablet is wonderful. i no longer need to bring my candle tablet with me; when waiting in a long line at costco, i just get my note 3 out and read. it does everything far more than i need.",True
ORD053007,ID2241718058,2019-01-26,Bakers,"[('Toshika 750', 1), ('Universe Note', 2), ('Candle Inferno', 1), ('iAssist Line', 2)]",16100,101.09,-37.8117262,145.01267099999995,10,14591.09,Summer,True,1.5457,four stars inexpensive - works fine - often just leave it in the car,True
ORD015018,ID4418536076,2019-07-04,Thompson,"[('Lucent 330S', 1), ('Toshika 750', 2)]",9870,83.36,-37.8024904,144.9634374,25,7485.86,Winter,True,1.8323,"five stars i love the feature on this phone ,and the ship time was excellent",True
ORD189402,ID4826905609,2019-11-22,Nickolson,"[('Toshika 750', 2), ('Thunder line', 1)]",10820,107.87,-37.8268424,144.955345,0,10927.87,Spring,True,1.5502,nice! love it!,True
ORD242690,ID0247012058,2019-06-09,Nickolson,"[('Lucent 330S', 2), ('pearTV', 1), ('iAssist Line', 2), ('Candle Inferno', 2)]",14080,92.145,-37.8115712,144.9684629,5,13468.145,Winter,True,0.7877,one star phone did not come with a sim card tray. i have not been able to activate.,False
ORD351246,ID6167266588,2019-03-18,Nickolson,"[('Candle Inferno', 2), ('Toshika 750', 2)]",9500,50.8,-37.81084,144.96454359999996,25,7175.8,Autumn,False,0.9691,"the earlier models were so simple to use. no nonsense listing of books in it's library, by author or title. now there are big pictures with tiny lettering and lots of ads.",False
ORD071419,ID0259159154,2019-03-29,Bakers,"[('Alcon 10', 2), ('Universe Note', 1), ('Thunder line', 2)]",25710,83.78,-37.8241973,144.9887903,25,19366.28,Autumn,True,1.6793,excellent seller. buyspry. cosmetically flawless. looks brand new. battery life like new. unlocked as described worked immediately that a sim card was inserted.,True
ORD185448,ID1224869063,2019-03-29,Thompson,"[('iAssist Line', 2), ('Candle Inferno', 2), ('Lucent 330S', 1)]",6540,78.58,-37.8136469,144.94090219999995,10,5964.58,Autumn,True,0.553,the quality! the performance is great! i am very surprised with this phone. recommended100%,True
ORD048136,ID0224761654,2019-05-17,Bakers,"[('pearTV', 2), ('iStream', 1)]",12770,63.94,-37.8051531,144.9940216,5,12195.44,Autumn,True,0.5495,the phone i got keeps saying that unauthorized action and ... the phone i got keeps saying that unauthorized action and needs to restart with a warning icon on top and cant use it,False
ORD197624,ID1241460740,2019-01-25,Bakers,"[('Olivia x460', 2), ('Lucent 330S', 2)]",4910,54.41,-37.81102720000001,144.9900001,0,4964.41,Summer,False,0.4742,dosnt work internet and picture messages won't work if you use this phone with t-mobile .... they only work with wifi on ... pointless,False
ORD319404,ID0054552158,2019-08-20,Nickolson,"[('Thunder line', 1), ('Olivia x460', 2)]",4630,79.41,-37.8211135,144.9837833,15,4014.91,Winter,True,1.2825,"great alcon x thank you very much, it works excellent and i have not had any problems. works with at&t mexico perfectly.",True
ORD320092,ID0259159111,2019-07-12,Nickolson,"[('Candle Inferno', 2), ('Toshika 750', 1)]",5180,47.78,-37.8229075,144.9711835,0,5227.78,Winter,False,0.5011,"falsely advertised. great phone, but not truly ""unlocked"" as advertised.....bootloader is locked, so can't install custom rom's, or root.",False
ORD023608,ID1650033635,2019-02-07,Bakers,"[('Universe Note', 1), ('Candle Inferno', 2), ('iStream', 1)]",4460,89.92,-37.819477,145.0147958,5,4326.92,Summer,True,2.0184,if it has guaranty? terrible phone. it die after 2 months we bought it i guess a lost my money,False
ORD016346,ID0294623058,2019-10-18,Nickolson,"[('iAssist Line', 2), ('Candle Inferno', 2), ('pearTV', 2)]",17930,72.89,-37.8190576,144.96424530000004,0,18002.89,Spring,False,0.4694,great has been great.,True
ORD165860,ID0269327461,2019-11-13,Nickolson,"[('Universe Note', 2), ('Olivia x460', 1), ('iAssist Line', 2)]",12575,61.86,-37.8164564,144.9790645,25,9493.11,Spring,False,0.8698,one star was sent completely non functioning phone. microphone does not work.,False
ORD163967,ID0310944924,2019-07-19,Bakers,"[('Olivia x460', 1), ('pearTV', 2), ('Alcon 10', 2), ('Candle Inferno', 2)]",32605,65.87,-37.8039614,145.0043169,5,31040.62,Winter,False,1.0439,"five stars phone like new, works fine, battery doesn't last very long. overall very good.",True
ORD281488,ID3240572176,2019-09-20,Thompson,"[('Universe Note', 1), ('iAssist Line', 1), ('Alcon 10', 2)]",23575,107.81,-37.8056525,144.9309168,5,22504.06,Spring,True,1.6213,best cell phone all good,True
ORD450881,ID0331420064,2019-05-24,Bakers,"[('Candle Inferno', 2), ('pearTV', 1), ('Lucent 330S', 1)]",8400,82.2,-37.8203354,145.0017179,10,7642.2,Autumn,True,1.2845,five stars i love this phone,True
ORD103054,ID0709977748,2019-07-10,Thompson,"[('Thunder line', 2), ('Universe Note', 1), ('Olivia x460', 1)]",9035,63.71,-37.8154856,144.935486,25,6839.96,Winter,True,1.0656,not like the original not like the original. feel cheaper. and lock sceen can only be configured in two ways. have press key to turn on screen then press * then unlock. takes like 3 button pressed to unlock.,False
ORD084224,ID0310957465,2019-06-09,Thompson,"[('Thunder line', 1), ('Toshika 750', 1), ('Universe Note', 1), ('Lucent 330S', 1)]",11180,77.96,-37.820953,144.9475811,10,10139.96,Winter,True,0.9228,meh. it's alright better than an ithing,True
ORD106238,ID0575397943,2019-11-14,Nickolson,"[('Thunder line', 1), ('Lucent 330S', 2), ('Candle Inferno', 1)]",5070,89.51,-37.82114960000001,144.9841856,5,4906.01,Spring,True,1.3179,"scratched badly!! the phone has deep scratches all over the phone, & it was not on the ""setup"" menu on start up. i'm leaning towards sending it back.",False
ORD401880,ID5402876148,2019-05-30,Nickolson,"[('Thunder line', 2), ('iAssist Line', 1)]",6585,63.19,-37.8193872,144.9768168,10,5989.69,Autumn,False,0.645,4 stars (no sd card slot) great phone best in class. photos on this thing are amazing. best screen for movie watching and reading. took one star away for the removal of sd card slot. 64gb is just enough storage.,True
ORD017332,ID4418536061,2019-09-19,Thompson,"[('Candle Inferno', 1), ('Universe Note', 1), ('Lucent 330S', 2)]",6340,84.27,-37.8029429,144.9633573,10,5790.27,Spring,False,1.7959,"olivia universe s6 works fine; i don't like all the stuff that clutters it up, but the unit itself is good, camera especially.",True
ORD430659,ID2421604152,2019-05-26,Nickolson,"[('Thunder line', 1), ('Olivia x460', 2)]",4630,69.06,-37.82456079999999,144.9564993,25,3541.56,Autumn,False,1.326,i love it really good,True
ORD054703,ID0547568737,2019-03-02,Bakers,"[('pearTV', 1), ('Lucent 330S', 1)]",7540,50.9,-37.8106068,144.98874640000003,0,7590.9,Autumn,False,0.5744,two stars it isn't what i expected..,False
ORD280603,ID5167159985,2019-06-27,Bakers,"[('Lucent 330S', 2), ('pearTV', 1), ('iStream', 2), ('Olivia x460', 1)]",10295,76.89,-37.81131660000001,145.00464340000005,0,10371.89,Winter,True,0.8406,lucentrola phone g7 great phone for the price,True
ORD420202,ID0260906797,2019-09-22,Bakers,"[('Universe Note', 2), ('Alcon 10', 1), ('iAssist Line', 1)]",18075,95.9,-37.8225901,145.0112938,15,15459.65,Spring,True,1.9901,"not worth buying i didn't buy from digico but from other sources. the phone worked ok for sometime but would not start one fine day and is completely dead. could not start at all. one led blinks when put in charge, otherwise it is completely dead. wasted time and money on this phone. would not recommend.",False
ORD247611,ID1350323383,2019-01-02,Nickolson,"[('Lucent 330S', 2), ('Candle Inferno', 2), ('iStream', 2), ('iAssist Line', 2)]",8070,56.89,-37.8203612,144.9777006,5,7723.39,Summer,False,0.7431,"some faults did not come with the original adapter (s7 comes with fast charge version). i write to the seller and i do not get an answer. also, the phone has certain flaws as it closes the apps suddenly and sometimes the screen freezes. very disappointed.",False
ORD180853,ID0387153047,2019-12-02,Thompson,"[('Thunder line', 2), ('Olivia x460', 1), ('Toshika 750', 2), ('Alcon 10', 1)]",23175,73.67,-37.8054203,144.947587,0,23248.67,Summer,False,0.8087,"amazing for the price. amazing. this phone is just incredible. for the price, this is a definite steal. mine had noooooo sign of use at all. scanner for face and fingers work great, charges fast, and battery lasts. just incredible.",True
ORD453273,ID0579502234,2019-05-17,Thompson,"[('iStream', 2), ('Toshika 750', 1), ('pearTV', 2)]",17240,62.87,-37.8146893,144.9504304,15,14716.87,Autumn,True,0.3712,unhappy we could not unlock this phone so we had to return it. very unsatisfied.,False
ORD236907,ID2174950796,2019-08-20,Thompson,"[('Candle Inferno', 2), ('pearTV', 2), ('iStream', 2), ('Alcon 10', 1)]",22730,76.89,-37.816084,144.9528785,5,21670.39,Winter,True,0.6365,"what's not to like? i love the phone. the look, the feel. it's awesome. sound is amazing and speed is great. i will enjoy it for a year until next black friday. i got it for 900 with free universe buds.",True
ORD487577,ID0307349581,2019-01-21,Nickolson,"[('Alcon 10', 1), ('Toshika 750', 2), ('iAssist Line', 2)]",22040,78.56,-37.8114359,144.980743,25,16608.56,Summer,False,1.2664,my inferno is compact and easy to use. mainly used to read online books at lunch time. the battery lasts much longer than previous tablet i had and charges much quicker. very happy with my inferno.,True
ORD196905,ID3213448190,2019-04-06,Thompson,"[('Thunder line', 2), ('Universe Note', 2), ('pearTV', 2)]",23880,66.99,-37.8057088,144.9577081,15,20364.99,Autumn,False,1.2151,"phone was great, but the ""new"" battery wouldn't hold a charge ... disapointed! phone was great, but the ""new"" battery wouldn't hold a charge long before dying. this was for my 78 yr old disabled dad and he can't use it. too much of a hassle spent charging all the time.",True
ORD227476,ID2249575579,2019-05-20,Bakers,"[('Lucent 330S', 2), ('Alcon 10', 2), ('Candle Inferno', 2)]",21220,68.45,-37.8256626,144.99794319999995,0,21288.45,Autumn,False,1.7602,great product delivered fast great product,True
ORD087709,ID0777773646,2019-10-05,Thompson,"[('Alcon 10', 2), ('Candle Inferno', 1), ('Thunder line', 2)]",22690,38.375,-37.8056823,144.95375,0,22728.375,Spring,False,0.9751,"i'm happy so far. i upgraded to s10+ after a long time of using an old a8. i'm very happy after around 3 months of use. i won't go in all the details, as i recommend you to check youtube videos about it. overall i would say, it has the best value for money among top segment phones.",True
ORD307092,ID3146808089,2019-10-01,Bakers,"[('pearTV', 1), ('Alcon 10', 1), ('Toshika 750', 1), ('iStream', 1)]",19730,100.3,-37.81322760000001,144.9905769,5,18843.8,Spring,True,0.545,"works perfect. the touch screen needs an extra touch though ... came very clean, almost new! works perfect. the touch screen needs an extra touch though but it works perfectly. i love it",True
ORD117023,ID0233315265,2019-07-18,Bakers,"[('Lucent 330S', 2), ('Olivia x460', 2), ('Candle Inferno', 2), ('Alcon 10', 2)]",23670,84.19,-37.799173,144.9794897,10,21387.19,Winter,True,1.8354,five stars very satisfied with this product,True
ORD035187,ID6087941570,2019-03-18,Thompson,"[('Alcon 10', 1), ('Candle Inferno', 1)]",9380,80.31,-37.80775420000001,144.96159609999995,15,8053.31,Autumn,True,1.39,"good specs, good price feels smooth and responsive, comes loaded with useful apps eliminating the need for many ad-filled 3rd party apps. regular firmware updates. screen brightness goes low enough to make it comfortable to use even at night.",True
ORD146479,ID3191033041,2019-06-12,Nickolson,"[('iAssist Line', 1), ('iStream', 2), ('Toshika 750', 1)]",6845,74.83,-37.8118662,144.9664971,0,6919.83,Winter,True,0.7957,"i bought this primarily for reading, but, being a tablet it is able to do so much more! i can listen to music, download movies and check email. i love it! way better than my nook!",True
ORD029681,ID0301537535,2019-03-14,Thompson,"[('Thunder line', 2), ('Lucent 330S', 1), ('Olivia x460', 2)]",8040,63.67,-37.8196604,144.9445767,0,8103.67,Autumn,True,0.8081,"just poor not really compatible with any carrier , att some bands, t-mobil some , verizon none, no firmware support here in the us and security updates are really old. stay away!!",False
ORD084292,ID0777833057,2019-05-07,Thompson,"[('Alcon 10', 2), ('Universe Note', 2), ('iStream', 2), ('Thunder line', 2)]",29460,81.32,-37.8040003,144.9585075,25,22176.32,Autumn,True,1.3943,good phone best renewed phone ever!,True
ORD133305,ID0650269089,2019-12-13,Nickolson,"[('Alcon 10', 1), ('iStream', 1), ('Candle Inferno', 2), ('Thunder line', 2)]",14320,73.84,-37.81429979999999,144.9779444,5,13677.84,Summer,False,0.8794,"great set for the price (248 after taxes) the phone built is great, as well as the toshika flip case, not to mentioned the 2 way headset. great package for the money",True
ORD462150,ID0844495962,2019-11-16,Thompson,"[('Candle Inferno', 2), ('Olivia x460', 2), ('Toshika 750', 1)]",7630,101.54,-37.819633,144.95203899999996,15,6587.04,Spring,True,0.8895,highly recommend it very good product ( you can't differentiate from new ) thank you buyspry,True
ORD251806,ID5727168129,2019-04-11,Nickolson,"[('Olivia x460', 2), ('Lucent 330S', 1), ('Alcon 10', 1), ('pearTV', 2)]",25250,81.45,-37.8253939,144.98088059999995,10,22806.45,Autumn,True,1.2511,"five stars very pleased with phone, i would recommend this to everyone.",True
ORD136986,ID0306968271,2019-09-09,Thompson,"[('Alcon 10', 1), ('Thunder line', 2)]",13310,80.59,-37.816446,144.93218290000004,10,12059.59,Spring,False,1.3748,i really like it its a nice phone that has lots of bells and whistles and i would highly recommend!!,True
ORD306741,ID0440051942,2019-08-18,Bakers,"[('Olivia x460', 2), ('iAssist Line', 2), ('Alcon 10', 1)]",15850,80.66,-37.8208406,144.9941675,15,13553.16,Winter,True,1.2108,great battery life still not great but everything else gets 5 thumbs up,True
ORD361578,ID0233262639,2019-08-12,Bakers,"[('Candle Inferno', 1), ('iAssist Line', 2), ('Thunder line', 2)]",9240,81.95,-37.8020574,144.98261369999997,0,9321.95,Winter,True,1.4187,not bad! works well and looks good too! didn’t have any scratches! so far so good!,True
ORD130002,ID0576879096,2019-08-21,Nickolson,"[('Alcon 10', 2), ('Universe Note', 2), ('iStream', 2)]",25100,79.03,-37.8203203,144.98088280000005,15,21414.03,Winter,True,1.0148,"best phone i have ever used the same quality as alcon, but only 1/4 price",True
ORD091085,ID4326586181,2019-02-28,Thompson,"[('iStream', 1), ('iAssist Line', 2), ('Candle Inferno', 2)]",5460,82.12,-37.8080916,144.96035700000004,10,4996.12,Summer,True,1.2751,"refund is not working. i took it to sprint technician and it's still keep saying ""simcard it's lock blah blah. can't call or use the internet.",False
ORD354513,ID2975211809,2019-03-07,Thompson,"[('iStream', 1), ('Alcon 10', 1), ('pearTV', 2), ('Toshika 750', 1)]",26040,69.18,-37.7997479,144.9631858,25,19599.18,Autumn,False,2.0198,my first opt on buying in the future! my wife loved the phone! great delivery time aswell! my first opt on buying in the future,True
ORD020278,ID4976805932,2019-07-04,Nickolson,"[('Candle Inferno', 2), ('Alcon 10', 2), ('Universe Note', 1), ('pearTV', 2)]",34830,78.46,-37.8112924,144.9637186,10,31425.46,Winter,True,0.9612,nice. very. nice.,True
ORD448433,ID0371972631,2019-02-27,Nickolson,"[('Alcon 10', 1), ('Thunder line', 1)]",11130,98.91,-37.8056402,144.97315849999995,15,9559.41,Summer,True,1.4766,great phone i would recommend this phone to anyone...and it takes great pictures,True
ORD299716,ID4327696179,2019-09-06,Bakers,"[('Olivia x460', 1), ('pearTV', 1), ('Toshika 750', 1), ('iStream', 2)]",12155,91.96,-37.824903000000006,144.9923348,5,11639.21,Spring,True,1.6788,alcon x me da un error que no se puede activar!,False
ORD475619,ID0767733273,2019-03-05,Nickolson,"[('Toshika 750', 2), ('Lucent 330S', 2), ('Olivia x460', 1)]",12325,52.56,-37.804187,144.971475,10,11145.06,Autumn,False,1.6128,"am dissatisfied very dissatisfied, phone is nothing like what is described. i purchase a unlock s6 and it was not unlock and the problem is still not resolved.",False
ORD287879,ID0418548288,2019-09-25,Bakers,"[('Thunder line', 2), ('Alcon 10', 2), ('iStream', 2)]",22560,52.485,-37.8229127,144.9873956,5,21484.485,Spring,True,1.5944,easy to use and has great sound...it was a great purchase at a great price.,True
