order_id,customer_id,date,nearest_warehouse,shopping_cart,order_price,delivery_charges,customer_lat,customer_long,coupon_discount,order_total,season,is_expedited_delivery,distance_to_nearest_warehouse,latest_customer_review,is_happy_customer
ORD346853,ID0030942252,2019-05-09,Thompson,"[('Alcon 10', 2), ('Candle Inferno', 2)]",18760,79.04,-37.805919,144.9392258,10,16963.04,Autumn,True,1.0203,four stars yes good price good phone!,True
ORD166524,ID0245807240,2019-08-23,Thompson,"[('Candle Inferno', 2), ('pearTV', 2), ('Thunder line', 1), ('Lucent 330S', 1)]",16890,72.24,-37.7993877,144.9581656,10,15273.24,Winter,False,1.7719,so far it has been an outstanding phone that i would highly recommend. really have been enjoying the s7 edge.so far it has been an outstanding phone that i would highly recommend.,True
ORD100537,ID0702451774,2019-04-07,Thompson,"[('iAssist Line', 1), ('iStream', 2), ('Lucent 330S', 1), ('pearTV', 1)]",10065,67.41,-37.8045489,144.9432618,5,9629.16,Autumn,False,0.9644,five stars great little phone!,True
ORD082467,ID4297530208,2019-10-19,Nickolson,"[('Alcon 10', 2), ('pearTV', 1), ('Thunder line', 2), ('Universe Note', 2)]",35470,83.29,-37.80569620000001,144.9772251,0,35553.29,Spring,False,1.5866,love androids my phone cost more than my laptop. phones are way overpriced for paying out of pocket. if you're paying for the phone without a contract give the consumer a break.,True
ORD483712,ID0579986298,2019-06-16,Thompson,"[('Toshika 750', 1), ('Lucent 330S', 1)]",5550,60.51,-37.8123341,144.9468664,0,5610.51,Winter,False,0.0417,"like it alots, something different than traditional television. the use of iassist is nice too.",True
ORD489366,ID0762836286,2019-06-19,Thompson,"[('Lucent 330S', 2), ('iAssist Line', 1)]",4685,51.04,-37.80348,144.936364,25,3564.79,Winter,False,1.3906,one star this is not an unlocked smartphone.it only works with verizon.i paid $900 .i had to return it.,False
ORD043723,ID0611991917,2019-12-15,Thompson,"[('Lucent 330S', 1), ('iStream', 1), ('Toshika 750', 1)]",5700,82.95,-37.8025333,144.954166,5,5497.95,Summer,True,1.2898,no good the absolute worst phone ever.....constantly shuts off without warning. would not recommend this at all! i would give it zero stars if i could!,False
ORD199409,ID2481930362,2019-08-09,Bakers,"[('Candle Inferno', 1), ('Olivia x460', 1), ('Lucent 330S', 1)]",2885,63.22,-37.8055111,144.9984334,0,2948.22,Winter,False,0.5732,i love it i love it. the phone is a little to big to go into your pants pocket but the phone is a good size to see or to hold in your hands.,True
ORD164781,ID0579497586,2019-06-12,Thompson,"[('Candle Inferno', 1), ('Universe Note', 1), ('pearTV', 1), ('iAssist Line', 2)]",14640,47.65,-37.814786700000006,144.9500749,10,13223.65,Winter,False,0.3539,crap at&t all ove the phone. wifi hotspot dont work (its locked). never have reception no matter where i am with straigt talk even tho everyone in my houshold have full reception on the same network. baterry is crap. and if you use the internet the phone overheats. worst buy ever,False
ORD208940,ID0594206733,2019-05-13,Nickolson,"[('Thunder line', 2), ('pearTV', 2)]",16980,77.82,-37.8162965,144.9657629,25,12812.82,Autumn,True,0.42,excellent purchase phone arrived quick and in better condition than expected. it's flawless. looks brand new and functions perfectly.,True
ORD208759,ID0591426700,2019-09-19,Nickolson,"[('Candle Inferno', 2), ('pearTV', 2), ('Olivia x460', 2)]",15930,75.27,-37.8188115,144.9625514,15,13615.77,Spring,False,0.616,works... fast ship. phone is in great condition just what i expected thanks for a good deal,True
ORD231942,ID0844496180,2019-02-14,Thompson,"[('Thunder line', 1), ('Lucent 330S', 1)]",3410,93.72,-37.8200777,144.95059650000005,15,2992.22,Summer,True,0.8807,loving it pretty great,True
ORD471487,ID0441588022,2019-07-23,Thompson,"[('Alcon 10', 1), ('Lucent 330S', 2), ('Universe Note', 2), ('iStream', 2)]",18610,50.28,-37.8114674,144.9365158,25,14007.78,Winter,False,0.9377,battery sucked had to buy a brand new one plus charger ... battery sucked had to buy a brand new one plus charger wouldn't charge the phone so also had to buy a charger,False
ORD123997,ID6209516581,2019-05-08,Nickolson,"[('Toshika 750', 2), ('iAssist Line', 2), ('Thunder line', 1), ('Olivia x460', 1)]",16495,82.17,-37.8027286,144.9665224,15,14102.92,Autumn,True,1.7862,"four stars this is a great phone, but as a former note2 owner i feel it's grown a bit too long.",True
ORD145702,ID2143839962,2019-09-05,Thompson,"[('Toshika 750', 1), ('iAssist Line', 2), ('pearTV', 1)]",15080,80.7,-37.8036511,144.9365946,0,15160.7,Spring,False,1.3628,bought as a gift for parents who aren't tech savy but were able to use it with ease,True
ORD007486,ID6167440999,2019-11-02,Nickolson,"[('iStream', 2), ('Candle Inferno', 2), ('Olivia x460', 2)]",3610,80.04,-37.81039060000001,144.9612267,5,3509.54,Spring,False,1.1705,"love it better technology and an amazing phone, love the features and getting to learn new things every day on this phone",True
ORD321923,ID6167278775,2019-04-24,Thompson,"[('iAssist Line', 1), ('Universe Note', 1), ('Alcon 10', 1)]",14625,78.94,-37.8123649,144.9544336,15,12510.19,Autumn,True,0.6486,"great! i love my new phone. i went to verizon, they set it up for me and had it running within an hour. i am still learning all the little details. but it is easy to use, and it's a great value!",True
ORD234110,ID3938525751,2019-05-23,Nickolson,"[('Toshika 750', 1), ('Lucent 330S', 2)]",6780,77.51,-37.82127929999999,144.966936,15,5840.51,Autumn,True,0.377,great phone if gps worked the phone is great for everyday biggest flaw is the gps malfunctions ramdomly,True
ORD249665,ID1459890794,2019-02-23,Bakers,"[('iStream', 2), ('Candle Inferno', 1), ('Thunder line', 1), ('Olivia x460', 1)]",4135,103.11,-37.8200096,145.01252069999995,15,3617.86,Summer,True,1.8852,"simple phone for husband this phone works great for my husband. he just wants a simple phone to use when needed. he doesn't want or need to go on the internet or take pictures, he just wants one to make phone calls. this phone works great for what he needs.",True
ORD336799,ID0663469696,2019-08-23,Bakers,"[('Thunder line', 2), ('Universe Note', 2)]",11260,71.65,-37.80001179999999,144.974997,0,11331.65,Winter,False,2.0982,"like everything about it. the music, the trivia games, the weather.",True
ORD150772,ID0579973149,2019-01-16,Thompson,"[('Alcon 10', 2), ('Toshika 750', 2), ('pearTV', 1)]",32850,50.55,-37.8115652,144.945775,25,24688.05,Summer,False,0.1678,wifi problems it runs good but my only problem so far i have is the wifi keeps disconnecting and it also shows a exclamation mark next to the wifi bars meaning it has trouble connecting. smh i shouldn't have bought this phone. don't waste you're money and i just got it today :(. i hope there's a solution,False
ORD409044,ID1459448723,2019-08-28,Bakers,"[('Candle Inferno', 2), ('Alcon 10', 1)]",9810,80.25,-37.8193751,145.0082644,10,8909.25,Winter,True,1.5503,works great for me (on sprint network) completely ready for a sim card and activation. working perfectly. no complaints.,True
ORD202777,ID0581740884,2019-03-14,Thompson,"[('iAssist Line', 2), ('Alcon 10', 2), ('pearTV', 2), ('Universe Note', 2)]",41870,83.6,-37.8049604,144.9315487,5,39860.1,Autumn,True,1.6125,five stars very pleased with my purchase,True
ORD053970,ID5797735127,2019-06-07,Thompson,"[('Thunder line', 1), ('Alcon 10', 1), ('iStream', 1)]",11280,67.47,-37.8035093,144.9484419,10,10219.47,Winter,False,1.0272,great product love this phone,True
ORD204921,ID6167266643,2019-11-06,Nickolson,"[('Thunder line', 2), ('iStream', 1), ('pearTV', 1), ('iAssist Line', 2)]",15270,40.45,-37.807562,144.963042,15,13019.95,Spring,False,1.355,three stars the phone is nice. it is starting to run slow and it freezes a lot.,True
ORD318956,ID2325017988,2019-10-13,Thompson,"[('Universe Note', 1), ('Lucent 330S', 2)]",5910,193.875,-37.834322,144.90516369999997,5,5808.375,Spring,True,4.4028,recommended great quality,True
ORD231407,ID0030945778,2019-11-19,Bakers,"[('iStream', 1), ('Olivia x460', 1), ('pearTV', 2)]",13995,76.36,-37.8169681,144.99016509999996,5,13371.61,Spring,False,0.8949,good value great phone for the price. can't see what i am missing by not buying more expensive model. fingerprint sensor is slow so i use pin.,True
ORD168211,ID0773059242,2019-06-06,Nickolson,"[('Olivia x460', 1), ('pearTV', 1)]",7535,76.59,-37.8113568,144.96943159999995,25,5727.84,Winter,True,0.8058,awesome purchased for my daughter's birthday. she loves it! works great and looks like new.,True
ORD497199,ID0355817578,2019-12-17,Bakers,"[('iAssist Line', 1), ('pearTV', 2), ('Olivia x460', 2), ('Alcon 10', 1)]",26245,77.28,-37.7993735,144.9931864,5,25010.03,Summer,False,1.1961,five stars great phone! arrived a day ahead of time 😊,True
ORD478257,ID5402983327,2019-12-09,Nickolson,"[('iAssist Line', 1), ('pearTV', 2), ('Thunder line', 2), ('Candle Inferno', 2)]",20065,87.29,-37.8194749,144.96314030000005,0,20152.29,Summer,True,0.5722,"nice phone for the money speed, battery life and features",True
ORD097951,ID0576879093,2019-05-30,Nickolson,"[('iStream', 2), ('pearTV', 1), ('Thunder line', 1), ('Lucent 330S', 2)]",11250,65.13,-37.8200353,144.9802538,5,10752.63,Autumn,False,0.9547,it's great!! light weight! charges quickly! great features!,True
ORD106683,ID0440051913,2019-02-26,Bakers,"[('Universe Note', 1), ('Alcon 10', 1)]",12400,60.54,-37.8207164,144.9935528,25,9360.54,Summer,False,1.2025,this phone is not unlocked! bought this phone instead of buying directly from olivia. big mistake! just save yourself the trouble and buy from olivia directly!,False
ORD413208,ID0207093554,2019-07-24,Bakers,"[('Universe Note', 1), ('iStream', 1), ('Alcon 10', 2)]",21500,76.31,-37.8053578,144.9995589,10,19426.31,Winter,True,0.6414,five stars good quality phone no issues.,True
ORD125079,ID1996808838,2019-10-21,Bakers,"[('pearTV', 2), ('Alcon 10', 1)]",21570,80.27,-37.8009874,144.992572,10,19493.27,Spring,False,1.0298,no regular pixel 2 xl display problem. looks amazing like new only....,True
ORD406506,ID0299023726,2019-01-16,Bakers,"[('Toshika 750', 2), ('Lucent 330S', 1), ('Candle Inferno', 2), ('Alcon 10', 2)]",28630,77.21,-37.8093318,145.0097176,5,27275.71,Summer,False,1.2761,very good. been using it for 2 weeks now. everything works great.,True
ORD320810,ID0091971021,2019-07-14,Thompson,"[('pearTV', 1), ('Alcon 10', 1), ('Lucent 330S', 2), ('Candle Inferno', 1)]",18150,74.04,-37.8178305,144.9487158,0,18224.04,Winter,True,0.5921,"one of the best purchased even factory refurb great phone, less expensive than getting a replacement phone thru carriers insurance plan.",True
ORD406415,ID0299892336,2019-02-27,Nickolson,"[('Thunder line', 1), ('Olivia x460', 2)]",4630,92.47,-37.8257965,144.9680325,15,4027.97,Summer,True,0.8127,"great little phone! my husband loves this phone. it is blue tooth compatible which he needs. sturdy, compact phone.",True
ORD437657,ID0844490706,2019-12-21,Thompson,"[('Universe Note', 2), ('iAssist Line', 2), ('Candle Inferno', 1)]",11780,59.69,-37.8207343,144.94882090000004,10,10661.69,Summer,False,0.9105,three stars i did not receive a charger just the phone,False
ORD285918,ID0387153066,2019-11-02,Thompson,"[('pearTV', 2), ('iStream', 2), ('Lucent 330S', 2)]",15380,52.185,-37.8016709,144.9499456,25,11587.185,Spring,True,1.2506,good phone i like this phone. it dose good. i do good with it.,True
ORD161508,ID0332794361,2019-04-16,Bakers,"[('Universe Note', 1), ('Candle Inferno', 1), ('Thunder line', 1)]",6060,81.01,-37.8088018,145.0050696,10,5535.01,Autumn,True,0.8753,love my droid 2 great phone,True
ORD052780,ID6221450530,2019-06-08,Bakers,"[('Universe Note', 1), ('Toshika 750', 1), ('iStream', 1)]",7920,63.46,-37.8088514,144.98326269999995,0,7983.46,Winter,True,1.0603,totally not satisfied there is a mark on screen from the day it came and there is lot of heating issue with phone,False
ORD016338,ID0370470107,2019-01-21,Bakers,"[('Lucent 330S', 2), ('iAssist Line', 2), ('pearTV', 1)]",13220,79.07,-37.8160204,145.0111408,25,9994.07,Summer,False,1.5515,five stars so far so good!,True
ORD336828,ID5172380749,2019-12-03,Thompson,"[('iStream', 2), ('Lucent 330S', 1), ('Olivia x460', 2)]",3980,79.31,-37.8057681,144.93335359999998,5,3860.31,Summer,False,1.4303,love my thunder great sound very smart!,True
ORD477794,ID0582798839,2019-01-18,Nickolson,"[('Lucent 330S', 2), ('iStream', 2), ('Toshika 750', 1), ('Candle Inferno', 1)]",7510,72.95,-37.8196171,144.9791999,0,7582.95,Summer,False,0.8561,ok great phone,True
ORD200482,ID0030942993,2019-05-15,Thompson,"[('Universe Note', 1), ('Thunder line', 2), ('iAssist Line', 2), ('pearTV', 1)]",18570,67.14,-37.8081466,144.95155,25,13994.64,Autumn,False,0.6397,i love it exelente,True
ORD270874,ID1479897562,2019-03-21,Nickolson,"[('Olivia x460', 1), ('Toshika 750', 1), ('Lucent 330S', 2)]",8005,64.18,-37.8201576,144.9582571,15,6868.43,Autumn,False,1.0082,"its the best, around. first day and so far i love my universe note! my s7 edge broke and i didn't want to buy a brand new phone. best deal i've seen so far and its beautiful!!",True
ORD004943,ID0248969199,2019-05-09,Bakers,"[('Alcon 10', 1), ('Candle Inferno', 1), ('Thunder line', 2), ('Olivia x460', 1)]",14965,64.81,-37.8046779,144.9920917,5,14281.56,Autumn,False,0.6533,"excellent, works perfect with digitel in actually this phone is unlocked, excellent, works perfect with digitel in venezuela",True
ORD293970,ID4884440848,2019-10-17,Thompson,"[('Thunder line', 1), ('iAssist Line', 1)]",4405,81.71,-37.7999149,144.93632649999995,10,4046.21,Spring,False,1.7058,awesome this phone has lasted me three years and it's only now starting to cause me problems. and that's probably because i don't treat it too well. i'm most likely going to buy the same phone to replace it.,True
ORD252679,ID0577457184,2019-10-17,Nickolson,"[('Olivia x460', 2), ('Toshika 750', 2)]",11090,103.16,-37.8204834,144.9811666,15,9529.66,Spring,True,1.0428,"would recommend to a friend! wonderful device, exceeds all of my expectations! have not had any issues with the device!",True
ORD398033,ID1404219801,2019-09-06,Bakers,"[('Lucent 330S', 1), ('Universe Note', 2), ('Toshika 750', 2), ('Thunder line', 1)]",18950,101.27,-37.8025023,144.9923117,10,17156.27,Spring,True,0.8728,five stars great job,True
ORD462784,ID1463656472,2019-09-11,Bakers,"[('iStream', 1), ('iAssist Line', 2)]",4600,73.72,-37.8168529,144.9953284,0,4673.72,Spring,False,0.7633,five stars it's very good phone. i love it so mush!!!,True
ORD297962,ID1492383930,2019-08-17,Thompson,"[('Candle Inferno', 2), ('pearTV', 2)]",13480,71.38,-37.8031088,144.9634489,5,12877.38,Winter,False,1.7913,i came highly recommended by miners and loggers my dad works in dusty rugged environment. he keeps breaking other phones. i came highly recommended by miners and loggers. so far so good.,True
ORD024599,ID6167359493,2019-03-08,Nickolson,"[('Universe Note', 1), ('Lucent 330S', 1)]",4680,64.4,-37.810853,144.9730038,15,4042.4,Autumn,True,0.9137,bad bad,False
ORD281204,ID4157118550,2019-02-16,Bakers,"[('Universe Note', 2), ('Toshika 750', 1), ('iStream', 1)]",11370,89.62,-37.8273122,145.013004,25,8617.12,Summer,False,2.4815,"if you're interested in this phone, then go for it. brand new, never opened for a great price. i'm personally not a fan of the biometric security features. it's a little too personal & invasive for my liking. other than that. awesome phone. very helpful seller as well.",True
ORD458276,ID0781093319,2019-06-16,Thompson,"[('Thunder line', 2), ('Lucent 330S', 1), ('Toshika 750', 2)]",14230,50.39,-37.8030255,144.94885580000005,25,10722.89,Winter,False,1.0854,phone battery already useless the phone is a disappointment. had it for only a month and a half and it shuts off when it is being charged. i think the battery is done. i have wasted a lot of money to purchase this phone.,False
ORD246788,ID5457965892,2019-10-25,Thompson,"[('Lucent 330S', 1), ('Alcon 10', 2), ('Thunder line', 2)]",23490,77.28,-37.8192403,144.9422498,0,23567.28,Spring,False,0.845,pretty sturdy its a pretty sturdy phone as for the feel. i havent used it sufficiently for knowing whether it works without a glitch.,True
ORD170450,ID2293523305,2019-10-09,Bakers,"[('Toshika 750', 2), ('Candle Inferno', 2), ('Alcon 10', 1), ('iStream', 1)]",18600,104.63,-37.7991659,144.99446880000005,15,15914.63,Spring,True,1.2075,great purchase simply awesome !,True
ORD198714,ID0575396015,2019-05-19,Nickolson,"[('Lucent 330S', 2), ('iStream', 1)]",2610,81.13,-37.8210743,144.9830055,25,2038.63,Autumn,True,1.2149,for what it is all is good. was a replacement for technically challenged mother in ... for what it is all is good. was a replacement for technically challenged mother in law. she probably makes two calls a year,True
ORD381164,ID6206956634,2019-11-10,Thompson,"[('Toshika 750', 2), ('iStream', 1)]",8790,93.12,-37.8031227,144.9635754,0,8883.12,Spring,True,1.7994,not working at all how i return this phon please it is not working properly iam regret to buy this phon sorry,False
ORD270546,ID0664379581,2019-03-16,Nickolson,"[('Lucent 330S', 2), ('Olivia x460', 2), ('Alcon 10', 1), ('Candle Inferno', 2)]",14720,63.15,-37.8204791,144.9660281,10,13311.15,Autumn,False,0.3741,thank you love it,True
ORD278876,ID0130015094,2019-09-16,Nickolson,"[('Universe Note', 1), ('iAssist Line', 2), ('iStream', 1)]",8050,72.83,-37.815717,144.96832619999995,25,6110.33,Spring,False,0.338,love the camera front work well with t mobile network,True
ORD161175,ID1964021896,2019-06-07,Nickolson,"[('Candle Inferno', 2), ('Thunder line', 2)]",5220,23.14,-37.8183782,144.96530049999996,5,4982.14,Winter,False,0.3745,... it to bender and have not got a response pleased do not buy from this bender this phone work just passed 30 days and just stop working sent a request to return it to bender and have not got a response pleased do not buy from this bender.,False
ORD457698,ID0313278217,2019-10-12,Nickolson,"[('pearTV', 1), ('Thunder line', 1), ('Candle Inferno', 1)]",8920,82.36,-37.8077348,144.9620648,25,6772.36,Spring,False,1.3766,five stars the product is in almost perfect conditions. very happy with this purchase.,True
ORD455895,ID0283334267,2019-03-13,Thompson,"[('Toshika 750', 1), ('Thunder line', 1), ('pearTV', 1), ('Olivia x460', 1)]",14035,65.83,-37.8026398,144.956068,25,10592.08,Autumn,True,1.3689,not recomended not recomended!! í ordered dual sim phone and received single sim,False
ORD130155,ID0566892220,2019-11-23,Nickolson,"[('Toshika 750', 1), ('Universe Note', 1)]",7770,92.2,-37.8050383,144.970424,15,6696.7,Spring,True,1.511,one star its not a new phone,False
ORD094691,ID3281799245,2019-07-04,Thompson,"[('pearTV', 2), ('Alcon 10', 1), ('Candle Inferno', 2)]",22430,70.04,-37.8240586,144.94263490000003,15,19135.54,Winter,False,1.326,i like that it knows my music type.the least is that it isn't wireless and the volume is not that high.,True
ORD394549,ID3204395235,2019-10-24,Thompson,"[('Thunder line', 2), ('Universe Note', 2)]",11260,74.84,-37.8068821,144.94913069999996,5,10771.84,Spring,False,0.6697,"great working with, and true to his/her word when i first bought my phone the battery did not last, then when contacted him about the battery him/her sent me one for free. thank you again so much.",True
ORD025184,ID1686695038,2019-05-29,Thompson,"[('iStream', 1), ('Thunder line', 1), ('Candle Inferno', 1)]",2760,82.08,-37.79836029999999,144.9443919,5,2704.08,Autumn,True,1.6106,five stars good product. original,True
ORD002867,ID0277089929,2019-08-01,Nickolson,"[('Thunder line', 2), ('Universe Note', 2), ('iAssist Line', 1), ('iStream', 2)]",13785,78.88,-37.8093102,144.9721699,25,10417.63,Winter,True,1.0589,got this at a great price as a second tablet. the battery life is so good that i use when traveling for movie watching. great screen and quick response times.,True
ORD033094,ID0377541501,2019-01-17,Thompson,"[('Olivia x460', 1), ('Universe Note', 1), ('Toshika 750', 1), ('pearTV', 1)]",15305,88.04,-37.8161912,144.9459981,25,11566.79,Summer,True,0.4028,yes i like it it’s just what the i expected,True
ORD414750,ID5797758277,2019-03-13,Thompson,"[('pearTV', 2), ('Alcon 10', 2), ('Olivia x460', 1)]",31745,78.41,-37.8068734,144.9453665,10,28648.91,Autumn,True,0.6627,satisfied phone was ordered yesterday and was delivered today. very impressed with the speed at which it was ordered. phone look just as was advertised. have not used it but it looks good.,True
ORD110301,ID1283634746,2019-01-16,Thompson,"[('iAssist Line', 2), ('iStream', 1), ('Toshika 750', 1), ('Candle Inferno', 1)]",9350,100.92,-37.8007651,144.95855480000003,5,8983.42,Summer,True,1.6666,five stars this was for my great niece and she loves it.,True
ORD337044,ID1479930075,2019-08-22,Thompson,"[('Toshika 750', 2), ('iStream', 2), ('iAssist Line', 2), ('Candle Inferno', 2)]",14250,78.1,-37.8209917,144.9550047,15,12190.6,Winter,True,1.1595,"great love the display and easy to use, though still learning what all it can do everyday.",True
ORD318873,ID0358732717,2019-09-17,Nickolson,"[('Lucent 330S', 1), ('iStream', 1)]",1380,80.17,-37.819467,144.9828569,25,1115.17,Spring,False,1.1741,perfecto trabaja excelente,True
ORD307132,ID0775942455,2019-11-27,Thompson,"[('Olivia x460', 2), ('iAssist Line', 1), ('iStream', 2), ('Toshika 750', 2)]",13615,79.79,-37.8067581,144.9610755,25,10291.04,Spring,False,1.3968,"love the phone and everything about it 5 stars, love the phone and everything about it, except the fact that putting on a screenguard is a pain.(atleast for me)",True
ORD466245,ID1053540500,2019-08-30,Bakers,"[('Olivia x460', 2), ('Universe Note', 1)]",5900,55.97,-37.8037698,145.0107711,25,4480.97,Winter,False,1.5324,it is good to have this as a backup. lags performance eventually. not worth for the money.,False
ORD484289,ID0575384236,2019-07-10,Nickolson,"[('Universe Note', 1), ('Thunder line', 1), ('iAssist Line', 1), ('Toshika 750', 1)]",12175,78.9,-37.8200086,144.9816241,10,11036.4,Winter,True,1.0732,really like it,True
ORD001179,ID0577454571,2019-03-23,Bakers,"[('Olivia x460', 2), ('iStream', 1)]",2600,67.08,-37.8235808,144.98841000000004,25,2017.08,Autumn,True,1.6269,too bad digico turned this tablet into a big advertising tool. many apps dont work and the camera is not good.,False
ORD054907,ID0207093572,2019-01-04,Bakers,"[('Thunder line', 2), ('Alcon 10', 2)]",22260,81.85,-37.8041467,145.0078254,5,21228.85,Summer,True,1.2848,"restarts continuously phone restarts continuously and as seller advertised, product doesn't have us warranty which manufacturer (lucentrolla) confirmed and denied replacement / service in us. am left with loosing money on this...",False
ORD303917,ID0628177929,2019-01-05,Thompson,"[('iAssist Line', 2), ('iStream', 2), ('Thunder line', 2)]",9110,72.74,-37.8121455,144.948192,10,8271.74,Summer,True,0.1149,do not buy edge cellular are slow worthless response worse customer service ever. phone is locked to sprint. sprint even told me it was locked but idiots at edge cellular says it's not. can not unlock phone without original number or pin. do not buy anything from edge cellular.,False
ORD454156,ID6167266595,2019-08-04,Nickolson,"[('Alcon 10', 1), ('Universe Note', 2), ('pearTV', 2), ('Olivia x460', 2)]",30920,52.23,-37.8094863,144.9639495,25,23242.23,Winter,False,1.1273,cheated theres ascratch on the glass on the side of the phone. also the white powder all over the face of the microphone. the price was cheated. decelived,False
ORD103228,ID6231506324,2019-08-10,Nickolson,"[('iStream', 2), ('Thunder line', 2)]",4660,64.14,-37.82426020000001,144.9700627,5,4491.14,Winter,False,0.6322,"great phone works really great nothing wrong with it for ... great phone works really great nothing wrong with it for price , the only thing i was not satisfied was does not come with sim card and this model is not the sprint spark model",True
ORD048335,ID4072557021,2019-10-02,Bakers,"[('Alcon 10', 1), ('Lucent 330S', 2), ('Candle Inferno', 2), ('Universe Note', 2)]",19170,73.32,-37.8130302,144.99579269999995,0,19243.32,Spring,False,0.3413,easy to connect and the skills created for our thunder 2nd gen worked fine with the line.,True
ORD181666,ID1725216215,2019-11-20,Thompson,"[('iStream', 1), ('Olivia x460', 2), ('Candle Inferno', 1)]",3030,167.445,-37.8002658,144.9625905,25,2439.945,Spring,True,1.9419,awesome phone and headset great combo.. excellent battery and performance...,True
ORD427265,ID0703550883,2019-10-24,Thompson,"[('Lucent 330S', 1), ('Alcon 10', 1), ('Candle Inferno', 2), ('Universe Note', 1)]",14490,62.8,-37.8106765,144.9580226,25,10930.3,Spring,False,0.9886,you get wath you paid not comparable to a pear tablet never,False
ORD345846,ID0575524488,2019-04-12,Nickolson,"[('iAssist Line', 1), ('pearTV', 1), ('Olivia x460', 2), ('Lucent 330S', 1)]",12215,78.86,-37.8198592,144.9810072,10,11072.36,Autumn,True,1.0172,bought for my wife.. she came from an alcon 4 so of course this phone is godlike to her lol. its a good phone and specs are really good. its plagued by olivias terrible software and slow carrier updates but i rooted it with cyanogenmod 11 and its a beast.,True
ORD237380,ID0616938662,2019-04-21,Nickolson,"[('Thunder line', 1), ('Universe Note', 2), ('Alcon 10', 2)]",26980,64.89,-37.8186204,144.961466,25,20299.89,Autumn,False,0.711,perfect love this phone i didn't need any of the features of the flagship phones. great in display fingerprint reader. works with t-mobile,True
ORD476036,ID3215192024,2019-04-10,Thompson,"[('Toshika 750', 2), ('Universe Note', 2)]",15540,61.87,-37.809324200000006,144.9464593,10,14047.87,Autumn,True,0.3766,two stars overheats and no updates were installed.,False
ORD359050,ID3208518277,2019-11-11,Nickolson,"[('iStream', 2), ('Toshika 750', 2)]",8940,93.44,-37.80379110000001,144.9675138,5,8586.44,Spring,True,1.6576,"two stars phone did not work, digico refunded",False
